{
  "corridor": "red_sea",
  "timestamp": "2026-07-21T14:29:49Z",
  "score": 0.0,
  "alert_level": "low",
  "sub_scores": {
    "news_sentiment": null,
    "sanctions_delta": 0.0,
    "ais_dark_fleet": null,
    "prediction_market": null,
    "futures_spread": null
  },
  "evidence": [
    {
      "source": "OFAC",
      "summary": "No new SDN entries detected for corridor 'red_sea'. Total relevant entries: 3300.",
      "url": "https://www.treasury.gov/ofac/downloads/sdn.csv",
      "timestamp": "2026-07-21T14:29:47.746382+00:00"
    }
  ]
}